{
  "video_path": "/absolute/path/to/video.mp4",
  "frame_idx": 120,
  "image_path": "/absolute/path/to/frame.jpg",
  "image_width": 1280,
  "image_height": 720,
  "players": {
    "P1": { "bbox": [220.0, 120.0, 420.0, 520.0] },
    "P2": { "bbox": [760.0, 150.0, 980.0, 610.0] }
  },
  "shuttle": {
    "visible": true,
    "x": 655.0,
    "y": 286.0
  },
  "pose": {
    "P1": [],
    "P2": []
  }
}

